{
  "kind": "repobrief.agent_benchmark_taskset",
  "version": "1.0",
  "id": "repobrief-agent-benchmark-v1-20260713",
  "measurement_scope": "frozen_paired_agent_ab",
  "repositories": [
    {
      "id": "lenskit",
      "repository": "heimgewebe/repoground",
      "commit": "dff582f9c4e8b5511d4ce436db81e3e245f725ec",
      "snapshot_profile": "agent-portable"
    },
    {
      "id": "grabowski",
      "repository": "heimgewebe/grabowski",
      "commit": "f6eed48752fd2cf32f070dc69b2112e2498872cb",
      "snapshot_profile": "agent-portable"
    },
    {
      "id": "weltgewebe",
      "repository": "heimgewebe/weltgewebe",
      "commit": "e095903bb71c937d861fa64d7e8a6b593062ca6f",
      "snapshot_profile": "agent-portable"
    }
  ],
  "tool_policy": {
    "baseline": [
      "glob",
      "grep",
      "read_file",
      "search"
    ],
    "treatment": [
      "ask_context",
      "glob",
      "grep",
      "grounding_verify",
      "live_freshness",
      "read_file",
      "repobrief_resource_read",
      "search"
    ]
  },
  "budgets": {
    "wall_seconds": 300,
    "input_tokens": 64000,
    "output_tokens": 6000,
    "max_tool_calls": 80,
    "max_tool_input_bytes": 1048576,
    "max_tool_output_bytes": 8388608
  },
  "thresholds": {
    "minimum_efficiency_improvement": 0.2,
    "minimum_success_rate_gain": 0.1,
    "maximum_class_success_regression": 0.05,
    "maximum_false_confidence_increase": 0.0
  },
  "cases": [
    {
      "id": "nav-lenskit-mcp-startup",
      "category": "navigation",
      "repository_id": "lenskit",
      "prompt": "Finde den stabilen Starter des lokalen RepoBrief-MCP-Servers und die eigentliche stdio-Implementierung. Nenne nur belegte Repository-Pfade.",
      "setup": {
        "working_tree": "clean"
      },
      "expectations": {
        "baseline": {
          "outcome": "answer",
          "required_paths": [
            "scripts/repoground-mcp-stdio.py",
            "merger/repoground/cli/mcp_stdio.py"
          ],
          "allowed_paths": [
            "scripts/repoground-mcp-stdio.py",
            "merger/repoground/cli/mcp_stdio.py",
            "docs/usage/repoground-mcp-stdio.md",
            "docs/architecture/repoground-mcp-boundary.md"
          ],
          "forbidden_paths": [],
          "required_symbols": [],
          "required_citations": [],
          "required_claims": [],
          "forbidden_claims": []
        },
        "treatment": {
          "outcome": "answer",
          "required_paths": [
            "scripts/repoground-mcp-stdio.py",
            "merger/repoground/cli/mcp_stdio.py"
          ],
          "allowed_paths": [
            "scripts/repoground-mcp-stdio.py",
            "merger/repoground/cli/mcp_stdio.py",
            "docs/usage/repoground-mcp-stdio.md",
            "docs/architecture/repoground-mcp-boundary.md"
          ],
          "forbidden_paths": [],
          "required_symbols": [],
          "required_citations": [],
          "required_claims": [],
          "forbidden_claims": []
        }
      },
      "tags": [
        "mcp",
        "entrypoint"
      ]
    },
    {
      "id": "nav-lenskit-live-freshness",
      "category": "navigation",
      "repository_id": "lenskit",
      "prompt": "Finde die Implementierung und den direkten Test der lokalen RepoBrief-Live-Freshness-Prüfung.",
      "setup": {
        "working_tree": "clean"
      },
      "expectations": {
        "baseline": {
          "outcome": "answer",
          "required_paths": [
            "merger/repoground/core/live_freshness.py",
            "merger/repoground/tests/test_live_freshness.py"
          ],
          "allowed_paths": [
            "merger/repoground/core/live_freshness.py",
            "merger/repoground/tests/test_live_freshness.py",
            "merger/repoground/tests/test_mcp_stdio_e2e.py",
            "docs/usage/repoground-mcp-stdio.md"
          ],
          "forbidden_paths": [],
          "required_symbols": [],
          "required_citations": [],
          "required_claims": [],
          "forbidden_claims": []
        },
        "treatment": {
          "outcome": "answer",
          "required_paths": [
            "merger/repoground/core/live_freshness.py",
            "merger/repoground/tests/test_live_freshness.py"
          ],
          "allowed_paths": [
            "merger/repoground/core/live_freshness.py",
            "merger/repoground/tests/test_live_freshness.py",
            "merger/repoground/tests/test_mcp_stdio_e2e.py",
            "docs/usage/repoground-mcp-stdio.md"
          ],
          "forbidden_paths": [],
          "required_symbols": [],
          "required_citations": [],
          "required_claims": [],
          "forbidden_claims": []
        }
      },
      "tags": [
        "freshness",
        "tests"
      ]
    },
    {
      "id": "nav-lenskit-agent-impact-core",
      "category": "navigation",
      "repository_id": "lenskit",
      "prompt": "Finde den Kern der Agent-Impact-Projektion und ihren primären Test.",
      "setup": {
        "working_tree": "clean"
      },
      "expectations": {
        "baseline": {
          "outcome": "answer",
          "required_paths": [
            "merger/repoground/core/agent_impact_context.py",
            "merger/repoground/tests/test_agent_impact_context.py"
          ],
          "allowed_paths": [
            "merger/repoground/core/agent_impact_context.py",
            "merger/repoground/tests/test_agent_impact_context.py",
            "merger/repoground/core/agent_impact_refinement.py",
            "docs/architecture/repobrief-agent-impact-context.md"
          ],
          "forbidden_paths": [],
          "required_symbols": [],
          "required_citations": [],
          "required_claims": [],
          "forbidden_claims": []
        },
        "treatment": {
          "outcome": "answer",
          "required_paths": [
            "merger/repoground/core/agent_impact_context.py",
            "merger/repoground/tests/test_agent_impact_context.py"
          ],
          "allowed_paths": [
            "merger/repoground/core/agent_impact_context.py",
            "merger/repoground/tests/test_agent_impact_context.py",
            "merger/repoground/core/agent_impact_refinement.py",
            "docs/architecture/repobrief-agent-impact-context.md"
          ],
          "forbidden_paths": [],
          "required_symbols": [],
          "required_citations": [],
          "required_claims": [],
          "forbidden_claims": []
        }
      },
      "tags": [
        "agent-impact",
        "tests"
      ]
    },
    {
      "id": "nav-lenskit-agent-impact-adapter",
      "category": "navigation",
      "repository_id": "lenskit",
      "prompt": "Finde den read-only Adapter der Agent-Impact-Fläche und die zugehörigen Adaptertests.",
      "setup": {
        "working_tree": "clean"
      },
      "expectations": {
        "baseline": {
          "outcome": "answer",
          "required_paths": [
            "merger/repoground/core/agent_impact_adapter.py",
            "merger/repoground/tests/test_agent_impact_adapter.py"
          ],
          "allowed_paths": [
            "merger/repoground/core/agent_impact_adapter.py",
            "merger/repoground/tests/test_agent_impact_adapter.py",
            "merger/repoground/tests/test_agent_impact_core_artifact_validation.py",
            "merger/repoground/cli/agent_impact.py"
          ],
          "forbidden_paths": [],
          "required_symbols": [],
          "required_citations": [],
          "required_claims": [],
          "forbidden_claims": []
        },
        "treatment": {
          "outcome": "answer",
          "required_paths": [
            "merger/repoground/core/agent_impact_adapter.py",
            "merger/repoground/tests/test_agent_impact_adapter.py"
          ],
          "allowed_paths": [
            "merger/repoground/core/agent_impact_adapter.py",
            "merger/repoground/tests/test_agent_impact_adapter.py",
            "merger/repoground/tests/test_agent_impact_core_artifact_validation.py",
            "merger/repoground/cli/agent_impact.py"
          ],
          "forbidden_paths": [],
          "required_symbols": [],
          "required_citations": [],
          "required_claims": [],
          "forbidden_claims": []
        }
      },
      "tags": [
        "adapter",
        "read-only"
      ]
    },
    {
      "id": "nav-grabowski-job-finalizer-test",
      "category": "navigation",
      "repository_id": "grabowski",
      "prompt": "Finde die Job-Finalizer-Implementierung und den realen zugehörigen Test. Rate keinen Testpfad.",
      "setup": {
        "working_tree": "clean"
      },
      "expectations": {
        "baseline": {
          "outcome": "answer",
          "required_paths": [
            "src/grabowski_job_finalizer.py",
            "tests/test_job_finalizer.py"
          ],
          "allowed_paths": [
            "src/grabowski_job_finalizer.py",
            "tests/test_job_finalizer.py",
            "tests/test_repository_contract.py",
            "src/grabowski_operator.py"
          ],
          "forbidden_paths": [
            "tests/test_grabowski_job_finalizer.py"
          ],
          "required_symbols": [],
          "required_citations": [],
          "required_claims": [],
          "forbidden_claims": []
        },
        "treatment": {
          "outcome": "answer",
          "required_paths": [
            "src/grabowski_job_finalizer.py",
            "tests/test_job_finalizer.py"
          ],
          "allowed_paths": [
            "src/grabowski_job_finalizer.py",
            "tests/test_job_finalizer.py",
            "tests/test_repository_contract.py",
            "src/grabowski_operator.py"
          ],
          "forbidden_paths": [
            "tests/test_grabowski_job_finalizer.py"
          ],
          "required_symbols": [],
          "required_citations": [],